{"format_version":"mstr.b005.discovery.v1","format_semantics":"Document/evidence format marker only. It is not a registered mstr_qualify runtime schema_version and creates no validator or project authority.","task_id":"B005","workstream_id":"MSTR-000B","canonical_main_sha":"e1b3cbd74ae0a74a80e3f345faef56da13818149","observed_at_utc":"2026-08-27","scope":{"public_metadata_only":true,"model_weight_access":false,"model_execution":false,"tokenizer_artifact_download":false,"paid_compute":false,"large_dataset_ingestion":false,"gated_terms_acceptance":false,"founder_machine_large_artifacts":false},"canonical_inputs":["schemas/candidate-record.schema.json","artifacts/decisions/T022-static-candidate-admission.json","specs/002-code-model-supremacy-foundation/tasks.md","specs/002-code-model-supremacy-foundation/plan.md"],"candidates":[{"repo_id":"Qwen/Qwen3.5-2B-Base","current_revision":"b1485b2fa6dfa1287294f269f5fb618e03d52d7c","revision_status":"EXACT_FULL_SHA","existing_candidate_id":"qwen3.5-2b","specialization":"general_base","provenance_observation":"Repository is named Base, but current model card reports training stage as Pre-training & Post-training; clean-foundation provenance requires B006 revalidation.","license_observation":"apache-2.0","access_gate_observation":"NO_PUBLIC_GATE_OBSERVED","parameter_observation":"2B nominal","context_observation_tokens":262144,"intended_use_observation":"General compact base checkpoint; current card also advertises very long context.","material_flags":["EXISTING_T022","PROVENANCE_REVALIDATION_REQUIRED"],"source_urls":["https://huggingface.co/Qwen/Qwen3.5-2B-Base","https://huggingface.co/Qwen/Qwen3.5-2B-Base/tree/main"]},{"repo_id":"Qwen/Qwen3.5-4B-Base","current_revision":"1001bb4d826a52d1f399e183466143f4da7b741b","revision_status":"EXACT_FULL_SHA","existing_candidate_id":"qwen3.5-4b","specialization":"general_base","provenance_observation":"Repository is named Base, but current model card reports training stage as Pre-training & Post-training; clean-foundation provenance requires B006 revalidation.","license_observation":"apache-2.0","access_gate_observation":"NO_PUBLIC_GATE_OBSERVED","parameter_observation":"4B nominal","context_observation_tokens":262144,"intended_use_observation":"General compact base checkpoint; current card also advertises very long context.","material_flags":["EXISTING_T022","PROVENANCE_REVALIDATION_REQUIRED"],"source_urls":["https://huggingface.co/Qwen/Qwen3.5-4B-Base","https://huggingface.co/Qwen/Qwen3.5-4B-Base/tree/main"]},{"repo_id":"mistralai/Ministral-3-3B-Base-2512","current_revision":"6f9c4b12a95b139af68670a6713616b757923735","revision_status":"EXACT_FULL_SHA","existing_candidate_id":"ministral-3-3b","specialization":"general_base_multimodal","provenance_observation":"Model card identifies a base pre-trained model and states it is not fine-tuned for instruction following or reasoning.","license_observation":"apache-2.0","access_gate_observation":"NO_CLICKTHROUGH_GATE_OBSERVED; MODEL_CARD_CONTAINS_GATING_METADATA_NOTE","parameter_observation":"CURRENT_CARD_BREAKDOWN=3.4B language + 0.4B vision encoder; HISTORICAL_EXACT_REVISION_RECORD_TOTAL=4,251,743,232. B006 must reconcile the differing parameter-accounting surfaces before serious admission.","context_observation_tokens":262144,"intended_use_observation":"Compact base model with long-context and multimodal components.","material_flags":["EXISTING_T022","LICENSE_TEXT_REVERIFY_AT_B006","VISION_COMPONENT_COST_REVIEW","PARAMETER_COUNT_REVALIDATION_REQUIRED"],"source_urls":["https://huggingface.co/mistralai/Ministral-3-3B-Base-2512","https://huggingface.co/mistralai/Ministral-3-3B-Base-2512/tree/main","evidence/candidates/T014-ministral-3-3b.md"]},{"repo_id":"Qwen/Qwen3-4B-Base","current_revision":"906bfd4b4dc7f14ee4320094d8b41684abff8539","revision_status":"EXACT_FULL_SHA","existing_candidate_id":"qwen3-4b","specialization":"general_base","provenance_observation":"Model card reports Pretraining.","license_observation":"apache-2.0","access_gate_observation":"NO_PUBLIC_GATE_OBSERVED","parameter_observation":"4.0B nominal","context_observation_tokens":32768,"intended_use_observation":"General compact base checkpoint.","material_flags":["EXISTING_T022"],"source_urls":["https://huggingface.co/Qwen/Qwen3-4B-Base","https://huggingface.co/Qwen/Qwen3-4B-Base/tree/main"]},{"repo_id":"ibm-granite/granite-4.1-3b-base","current_revision":"dacb9cb9157bec98e99b09f285c92a4d58405c96","revision_status":"EXACT_FULL_SHA","existing_candidate_id":"granite-4.1-3b","specialization":"general_plus_code_base","provenance_observation":"Base checkpoint with multi-stage pre/mid-training; model card includes code/FIM use.","license_observation":"apache-2.0","access_gate_observation":"NO_PUBLIC_GATE_OBSERVED","parameter_observation":"3B nominal","context_observation_tokens":131072,"intended_use_observation":"General text and fill-in-the-middle code completion; card separately describes context extension beyond the trained sequence length.","material_flags":["EXISTING_T022","LICENSE_TEXT_REVERIFY_AT_B006","CONTEXT_EXTENSION_CLAIM_SEPARATE_FROM_TRAINED_SEQUENCE"],"source_urls":["https://huggingface.co/ibm-granite/granite-4.1-3b-base","https://huggingface.co/ibm-granite/granite-4.1-3b-base/tree/main"]},{"repo_id":"HuggingFaceTB/SmolLM3-3B-Base","current_revision":"d78a42f79198603e614095753484a04c10c2b940","revision_status":"EXACT_FULL_SHA","existing_candidate_id":"smollm3-3b","specialization":"general_base_with_code_data","provenance_observation":"Model card explicitly calls this the base model after pretraining; pretraining used web, code, math and reasoning data.","license_observation":"apache-2.0","access_gate_observation":"NO_PUBLIC_GATE_OBSERVED","parameter_observation":"3B nominal","context_observation_tokens":65536,"intended_use_observation":"Small general base model; current config is 65,536 and model card describes YaRN extrapolation beyond it.","material_flags":["EXISTING_T022","LICENSE_TEXT_REVERIFY_AT_B006","YARN_EXTENSION_SEPARATE_FROM_NATIVE_CONFIG"],"source_urls":["https://huggingface.co/HuggingFaceTB/SmolLM3-3B-Base","https://huggingface.co/HuggingFaceTB/SmolLM3-3B-Base/tree/main"]},{"repo_id":"Qwen/Qwen2.5-Coder-1.5B","current_revision":"df3ce67c0e24480f20468b6ef2894622d69eb73b","revision_status":"EXACT_FULL_SHA","existing_candidate_id":"qwen2.5-coder-1.5b","specialization":"code_specialized_base","provenance_observation":"Model card describes a code-specific pretraining-stage checkpoint.","license_observation":"apache-2.0","access_gate_observation":"NO_PUBLIC_GATE_OBSERVED","parameter_observation":"1.54B nominal","context_observation_tokens":32768,"intended_use_observation":"Code generation/reasoning/fixing control; historical optional long-context instructions are separate from current config context.","material_flags":["EXISTING_T022","CODE_SPECIALIZED_CONTROL"],"source_urls":["https://huggingface.co/Qwen/Qwen2.5-Coder-1.5B","https://huggingface.co/Qwen/Qwen2.5-Coder-1.5B/tree/main"]},{"repo_id":"01-ai/Yi-Coder-1.5B","current_revision":"00e59e64f47d3c78e4cfbdd345888479797e8109","revision_status":"EXACT_FULL_SHA","existing_candidate_id":"yi-coder-1.5b","specialization":"code_specialized","provenance_observation":"Code-specialized checkpoint; exact base/post-training lineage should be revalidated in B006 before primary admission.","license_observation":"apache-2.0","access_gate_observation":"NO_PUBLIC_GATE_OBSERVED","parameter_observation":"Repo name says 1.5B; Hugging Face model-size metadata reports 1B class","context_observation_tokens":131072,"intended_use_observation":"Code generation/completion across many programming languages.","material_flags":["EXISTING_T022","PARAMETER_COUNT_REVALIDATION_REQUIRED","PROVENANCE_REVALIDATION_REQUIRED"],"source_urls":["https://huggingface.co/01-ai/Yi-Coder-1.5B","https://huggingface.co/01-ai/Yi-Coder-1.5B/tree/main"]},{"repo_id":"JetBrains/Mellum-4b-base","current_revision":"83cce2605fbdf6a3868627e9b0a5924e0072b94d","revision_status":"EXACT_FULL_SHA","existing_candidate_id":null,"specialization":"code_specialized_base","provenance_observation":"JetBrains describes this as its open-source base code model.","license_observation":"apache-2.0","access_gate_observation":"NO_PUBLIC_GATE_OBSERVED","parameter_observation":"4B nominal","context_observation_tokens":8192,"intended_use_observation":"Code completion and software-development workloads, including IDE-oriented use.","material_flags":["NEWLY_RELEVANT","MANDATORY_B005_REVIEW","B006_REVIEW_REQUIRED","MISSION_ALIGNED_T022_OMISSION"],"source_urls":["https://huggingface.co/JetBrains/Mellum-4b-base","https://huggingface.co/JetBrains/Mellum-4b-base/tree/main"]},{"repo_id":"bigcode/starcoder2-3b","current_revision":"733247c55e3f73af49ce8e9c7949bf14af205928","revision_status":"EXACT_FULL_SHA","existing_candidate_id":null,"specialization":"code_specialized_base","provenance_observation":"Code-specific pretrained model from the StarCoder2 family.","license_observation":"bigcode-openrail-m","access_gate_observation":"NO_PUBLIC_GATE_OBSERVED","parameter_observation":"3B nominal","context_observation_tokens":16384,"intended_use_observation":"Code generation/completion over The Stack v2-era training data.","material_flags":["NEWLY_RELEVANT","B006_RIGHTS_REVIEW_REQUIRED","NON_APACHE_LICENSE"],"source_urls":["https://huggingface.co/bigcode/starcoder2-3b","https://huggingface.co/bigcode/starcoder2-3b/tree/main"]},{"repo_id":"stabilityai/stable-code-3b","current_revision":"5cee3fa2905e7a03c4a1b0bc02f39da7ceaa6cb5","revision_status":"EXACT_FULL_SHA","existing_candidate_id":null,"specialization":"code_specialized_base","provenance_observation":"Model card identifies a foundational code base model intended for application-specific fine-tuning.","license_observation":"other / Stability AI model license","access_gate_observation":"NO_PUBLIC_GATE_OBSERVED","parameter_observation":"2,796,431,360","context_observation_tokens":16384,"intended_use_ob